{
  "alias": "METRONA",
  "name": "TOP_65_METRONA",
  "nodes": [
    {
      "id": 0
    },
    {
      "id": 1
    },
    {
      "id": 2
    },
    {
      "id": 3
    },
    {
      "id": 4
    },
    {
      "id": 5
    },
    {
      "id": 6
    },
    {
      "id": 7
    },
    {
      "id": 8
    },
    {
      "id": 9
    },
    {
      "id": 10
    },
    {
      "id": 11
    },
    {
      "id": 12
    },
    {
      "id": 13
    },
    {
      "id": 14
    },
    {
      "id": 15
    },
    {
      "id": 16
    },
    {
      "id": 17
    },
    {
      "id": 18
    },
    {
      "id": 19
    },
    {
      "id": 20
    },
    {
      "id": 21
    },
    {
      "id": 22
    },
    {
      "id": 23
    },
    {
      "id": 24
    },
    {
      "id": 25
    },
    {
      "id": 26
    },
    {
      "id": 27
    },
    {
      "id": 28
    },
    {
      "id": 29
    },
    {
      "id": 30
    },
    {
      "id": 31
    },
    {
      "id": 32
    }
  ],
  "links": [
    {
      "id": 0,
      "src": 0,
      "dst": 1,
      "length": 87.57000000000001
    },
    {
      "id": 1,
      "src": 1,
      "dst": 0,
      "length": 87.57000000000001
    },
    {
      "id": 2,
      "src": 0,
      "dst": 4,
      "length": 302.895
    },
    {
      "id": 3,
      "src": 4,
      "dst": 0,
      "length": 302.895
    },
    {
      "id": 4,
      "src": 1,
      "dst": 2,
      "length": 73.725
    },
    {
      "id": 5,
      "src": 2,
      "dst": 1,
      "length": 73.725
    },
    {
      "id": 6,
      "src": 2,
      "dst": 3,
      "length": 90.27
    },
    {
      "id": 7,
      "src": 3,
      "dst": 2,
      "length": 90.27
    },
    {
      "id": 8,
      "src": 3,
      "dst": 8,
      "length": 169.125
    },
    {
      "id": 9,
      "src": 8,
      "dst": 3,
      "length": 169.125
    },
    {
      "id": 10,
      "src": 3,
      "dst": 20,
      "length": 128.97
    },
    {
      "id": 11,
      "src": 20,
      "dst": 3,
      "length": 128.97
    },
    {
      "id": 12,
      "src": 4,
      "dst": 5,
      "length": 133.77
    },
    {
      "id": 13,
      "src": 5,
      "dst": 4,
      "length": 133.77
    },
    {
      "id": 14,
      "src": 5,
      "dst": 11,
      "length": 114.42
    },
    {
      "id": 15,
      "src": 11,
      "dst": 5,
      "length": 114.42
    },
    {
      "id": 16,
      "src": 6,
      "dst": 7,
      "length": 82.785
    },
    {
      "id": 17,
      "src": 7,
      "dst": 6,
      "length": 82.785
    },
    {
      "id": 18,
      "src": 6,
      "dst": 20,
      "length": 201.51
    },
    {
      "id": 19,
      "src": 20,
      "dst": 6,
      "length": 201.51
    },
    {
      "id": 20,
      "src": 7,
      "dst": 20,
      "length": 154.155
    },
    {
      "id": 21,
      "src": 20,
      "dst": 7,
      "length": 154.155
    },
    {
      "id": 22,
      "src": 8,
      "dst": 20,
      "length": 177.87
    },
    {
      "id": 23,
      "src": 20,
      "dst": 8,
      "length": 177.87
    },
    {
      "id": 24,
      "src": 8,
      "dst": 11,
      "length": 87.9
    },
    {
      "id": 25,
      "src": 11,
      "dst": 8,
      "length": 87.9
    },
    {
      "id": 26,
      "src": 9,
      "dst": 11,
      "length": 123.855
    },
    {
      "id": 27,
      "src": 11,
      "dst": 9,
      "length": 123.855
    },
    {
      "id": 28,
      "src": 9,
      "dst": 10,
      "length": 129.6
    },
    {
      "id": 29,
      "src": 10,
      "dst": 9,
      "length": 129.6
    },
    {
      "id": 30,
      "src": 10,
      "dst": 14,
      "length": 155.79
    },
    {
      "id": 31,
      "src": 14,
      "dst": 10,
      "length": 155.79
    },
    {
      "id": 32,
      "src": 11,
      "dst": 12,
      "length": 7392.174999999999
    },
    {
      "id": 33,
      "src": 12,
      "dst": 11,
      "length": 7392.174999999999
    },
    {
      "id": 34,
      "src": 12,
      "dst": 14,
      "length": 7332.212500000001
    },
    {
      "id": 35,
      "src": 14,
      "dst": 12,
      "length": 7332.212500000001
    },
    {
      "id": 36,
      "src": 12,
      "dst": 13,
      "length": 7295.175
    },
    {
      "id": 37,
      "src": 13,
      "dst": 12,
      "length": 7295.175
    },
    {
      "id": 38,
      "src": 13,
      "dst": 15,
      "length": 68.4
    },
    {
      "id": 39,
      "src": 15,
      "dst": 13,
      "length": 68.4
    },
    {
      "id": 40,
      "src": 15,
      "dst": 16,
      "length": 32.55
    },
    {
      "id": 41,
      "src": 16,
      "dst": 15,
      "length": 32.55
    },
    {
      "id": 42,
      "src": 15,
      "dst": 19,
      "length": 41.625
    },
    {
      "id": 43,
      "src": 19,
      "dst": 15,
      "length": 41.625
    },
    {
      "id": 44,
      "src": 16,
      "dst": 17,
      "length": 30.93
    },
    {
      "id": 45,
      "src": 17,
      "dst": 16,
      "length": 30.93
    },
    {
      "id": 46,
      "src": 17,
      "dst": 18,
      "length": 128.7
    },
    {
      "id": 47,
      "src": 18,
      "dst": 17,
      "length": 128.7
    },
    {
      "id": 48,
      "src": 18,
      "dst": 26,
      "length": 69.885
    },
    {
      "id": 49,
      "src": 26,
      "dst": 18,
      "length": 69.885
    },
    {
      "id": 50,
      "src": 19,
      "dst": 20,
      "length": 58.02
    },
    {
      "id": 51,
      "src": 20,
      "dst": 19,
      "length": 58.02
    },
    {
      "id": 52,
      "src": 19,
      "dst": 21,
      "length": 93.795
    },
    {
      "id": 53,
      "src": 21,
      "dst": 19,
      "length": 93.795
    },
    {
      "id": 54,
      "src": 21,
      "dst": 22,
      "length": 77.535
    },
    {
      "id": 55,
      "src": 22,
      "dst": 21,
      "length": 77.535
    },
    {
      "id": 56,
      "src": 22,
      "dst": 23,
      "length": 75.135
    },
    {
      "id": 57,
      "src": 23,
      "dst": 22,
      "length": 75.135
    },
    {
      "id": 58,
      "src": 22,
      "dst": 25,
      "length": 71.685
    },
    {
      "id": 59,
      "src": 25,
      "dst": 22,
      "length": 71.685
    },
    {
      "id": 60,
      "src": 22,
      "dst": 24,
      "length": 64.785
    },
    {
      "id": 61,
      "src": 24,
      "dst": 22,
      "length": 64.785
    },
    {
      "id": 62,
      "src": 23,
      "dst": 24,
      "length": 65.475
    },
    {
      "id": 63,
      "src": 24,
      "dst": 23,
      "length": 65.475
    },
    {
      "id": 64,
      "src": 24,
      "dst": 30,
      "length": 235.695
    },
    {
      "id": 65,
      "src": 30,
      "dst": 24,
      "length": 235.695
    },
    {
      "id": 66,
      "src": 25,
      "dst": 26,
      "length": 20.505
    },
    {
      "id": 67,
      "src": 26,
      "dst": 25,
      "length": 20.505
    },
    {
      "id": 68,
      "src": 25,
      "dst": 27,
      "length": 139.815
    },
    {
      "id": 69,
      "src": 27,
      "dst": 25,
      "length": 139.815
    },
    {
      "id": 70,
      "src": 27,
      "dst": 28,
      "length": 56.835
    },
    {
      "id": 71,
      "src": 28,
      "dst": 27,
      "length": 56.835
    },
    {
      "id": 72,
      "src": 28,
      "dst": 29,
      "length": 24.81
    },
    {
      "id": 73,
      "src": 29,
      "dst": 28,
      "length": 24.81
    },
    {
      "id": 74,
      "src": 29,
      "dst": 30,
      "length": 191.655
    },
    {
      "id": 75,
      "src": 30,
      "dst": 29,
      "length": 191.655
    },
    {
      "id": 76,
      "src": 29,
      "dst": 31,
      "length": 221.07
    },
    {
      "id": 77,
      "src": 31,
      "dst": 29,
      "length": 221.07
    },
    {
      "id": 78,
      "src": 31,
      "dst": 32,
      "length": 100.455
    },
    {
      "id": 79,
      "src": 32,
      "dst": 31,
      "length": 100.455
    },
    {
      "id": 80,
      "src": 32,
      "dst": 30,
      "length": 145.275
    },
    {
      "id": 81,
      "src": 30,
      "dst": 32,
      "length": 145.275
    }
  ]
}
