{
  "alias": "DT17",
  "name": "TOP_27_DT17",
  "nodes": [
    {
      "id": 0
    },
    {
      "id": 1
    },
    {
      "id": 2
    },
    {
      "id": 3
    },
    {
      "id": 4
    },
    {
      "id": 5
    },
    {
      "id": 6
    },
    {
      "id": 7
    },
    {
      "id": 8
    },
    {
      "id": 9
    },
    {
      "id": 10
    },
    {
      "id": 11
    },
    {
      "id": 12
    },
    {
      "id": 13
    }
  ],
  "links": [
    {
      "id": 0,
      "src": 0,
      "dst": 6,
      "length": 306.3
    },
    {
      "id": 1,
      "src": 6,
      "dst": 0,
      "length": 306.3
    },
    {
      "id": 2,
      "src": 0,
      "dst": 7,
      "length": 160.9
    },
    {
      "id": 3,
      "src": 7,
      "dst": 0,
      "length": 160.9
    },
    {
      "id": 4,
      "src": 0,
      "dst": 9,
      "length": 173.3
    },
    {
      "id": 5,
      "src": 9,
      "dst": 0,
      "length": 173.3
    },
    {
      "id": 6,
      "src": 1,
      "dst": 6,
      "length": 114.7
    },
    {
      "id": 7,
      "src": 6,
      "dst": 1,
      "length": 114.7
    },
    {
      "id": 8,
      "src": 1,
      "dst": 7,
      "length": 121.3
    },
    {
      "id": 9,
      "src": 7,
      "dst": 1,
      "length": 121.3
    },
    {
      "id": 10,
      "src": 1,
      "dst": 4,
      "length": 278.5
    },
    {
      "id": 11,
      "src": 4,
      "dst": 1,
      "length": 278.5
    },
    {
      "id": 12,
      "src": 2,
      "dst": 4,
      "length": 37.4
    },
    {
      "id": 13,
      "src": 4,
      "dst": 2,
      "length": 37.4
    },
    {
      "id": 14,
      "src": 2,
      "dst": 7,
      "length": 230.4
    },
    {
      "id": 15,
      "src": 7,
      "dst": 2,
      "length": 230.4
    },
    {
      "id": 16,
      "src": 2,
      "dst": 8,
      "length": 84.3
    },
    {
      "id": 17,
      "src": 8,
      "dst": 2,
      "length": 84.3
    },
    {
      "id": 18,
      "src": 3,
      "dst": 4,
      "length": 36.9
    },
    {
      "id": 19,
      "src": 4,
      "dst": 3,
      "length": 36.9
    },
    {
      "id": 20,
      "src": 3,
      "dst": 8,
      "length": 40.9
    },
    {
      "id": 21,
      "src": 8,
      "dst": 3,
      "length": 40.9
    },
    {
      "id": 22,
      "src": 5,
      "dst": 7,
      "length": 313.9
    },
    {
      "id": 23,
      "src": 7,
      "dst": 5,
      "length": 313.9
    },
    {
      "id": 24,
      "src": 5,
      "dst": 8,
      "length": 182.0
    },
    {
      "id": 25,
      "src": 8,
      "dst": 5,
      "length": 182.0
    },
    {
      "id": 26,
      "src": 5,
      "dst": 9,
      "length": 352.6
    },
    {
      "id": 27,
      "src": 9,
      "dst": 5,
      "length": 352.6
    },
    {
      "id": 28,
      "src": 5,
      "dst": 12,
      "length": 207.4
    },
    {
      "id": 29,
      "src": 12,
      "dst": 5,
      "length": 207.4
    },
    {
      "id": 30,
      "src": 5,
      "dst": 11,
      "length": 224.1
    },
    {
      "id": 31,
      "src": 11,
      "dst": 5,
      "length": 224.1
    },
    {
      "id": 32,
      "src": 7,
      "dst": 9,
      "length": 257.2
    },
    {
      "id": 33,
      "src": 9,
      "dst": 7,
      "length": 257.2
    },
    {
      "id": 34,
      "src": 9,
      "dst": 11,
      "length": 274.4
    },
    {
      "id": 35,
      "src": 11,
      "dst": 9,
      "length": 274.4
    },
    {
      "id": 36,
      "src": 10,
      "dst": 11,
      "length": 180.8
    },
    {
      "id": 37,
      "src": 11,
      "dst": 10,
      "length": 180.8
    },
    {
      "id": 38,
      "src": 10,
      "dst": 13,
      "length": 145.6
    },
    {
      "id": 39,
      "src": 13,
      "dst": 10,
      "length": 145.6
    },
    {
      "id": 40,
      "src": 11,
      "dst": 12,
      "length": 188.7
    },
    {
      "id": 41,
      "src": 12,
      "dst": 11,
      "length": 188.7
    },
    {
      "id": 42,
      "src": 12,
      "dst": 13,
      "length": 37.1
    },
    {
      "id": 43,
      "src": 13,
      "dst": 12,
      "length": 37.1
    },
    {
      "id": 44,
      "src": 0,
      "dst": 7,
      "length": 294.9
    },
    {
      "id": 45,
      "src": 7,
      "dst": 0,
      "length": 294.9
    }
  ]
}
