{
  "alias": "RENATER1999",
  "name": "TOP_89_RENATER1999",
  "nodes": [
    {
      "id": 0
    },
    {
      "id": 1
    },
    {
      "id": 2
    },
    {
      "id": 3
    },
    {
      "id": 4
    },
    {
      "id": 5
    },
    {
      "id": 6
    },
    {
      "id": 7
    },
    {
      "id": 8
    },
    {
      "id": 9
    },
    {
      "id": 10
    },
    {
      "id": 11
    },
    {
      "id": 12
    },
    {
      "id": 13
    },
    {
      "id": 14
    },
    {
      "id": 15
    },
    {
      "id": 16
    },
    {
      "id": 17
    },
    {
      "id": 18
    },
    {
      "id": 19
    },
    {
      "id": 20
    },
    {
      "id": 21
    },
    {
      "id": 22
    },
    {
      "id": 23
    }
  ],
  "links": [
    {
      "id": 0,
      "src": 0,
      "dst": 15,
      "length": 310.1353076025006
    },
    {
      "id": 1,
      "src": 15,
      "dst": 0,
      "length": 310.1353076025006
    },
    {
      "id": 2,
      "src": 1,
      "dst": 11,
      "length": 881.9148496472068
    },
    {
      "id": 3,
      "src": 11,
      "dst": 1,
      "length": 881.9148496472068
    },
    {
      "id": 4,
      "src": 1,
      "dst": 6,
      "length": 294.7081152484741
    },
    {
      "id": 5,
      "src": 6,
      "dst": 1,
      "length": 294.7081152484741
    },
    {
      "id": 6,
      "src": 2,
      "dst": 11,
      "length": 162.9284693466608
    },
    {
      "id": 7,
      "src": 11,
      "dst": 2,
      "length": 162.9284693466608
    },
    {
      "id": 8,
      "src": 2,
      "dst": 15,
      "length": 285.5552568765627
    },
    {
      "id": 9,
      "src": 15,
      "dst": 2,
      "length": 285.5552568765627
    },
    {
      "id": 10,
      "src": 3,
      "dst": 15,
      "length": 164.8408021406742
    },
    {
      "id": 11,
      "src": 15,
      "dst": 3,
      "length": 164.8408021406742
    },
    {
      "id": 12,
      "src": 4,
      "dst": 11,
      "length": 391.9101437019439
    },
    {
      "id": 13,
      "src": 11,
      "dst": 4,
      "length": 391.9101437019439
    },
    {
      "id": 14,
      "src": 4,
      "dst": 5,
      "length": 114.8694624115643
    },
    {
      "id": 15,
      "src": 5,
      "dst": 4,
      "length": 114.8694624115643
    },
    {
      "id": 16,
      "src": 7,
      "dst": 10,
      "length": 206.0046605848057
    },
    {
      "id": 17,
      "src": 10,
      "dst": 7,
      "length": 206.0046605848057
    },
    {
      "id": 18,
      "src": 8,
      "dst": 10,
      "length": 140.4186699208927
    },
    {
      "id": 19,
      "src": 10,
      "dst": 8,
      "length": 140.4186699208927
    },
    {
      "id": 20,
      "src": 9,
      "dst": 12,
      "length": 327.2726517839708
    },
    {
      "id": 21,
      "src": 12,
      "dst": 9,
      "length": 327.2726517839708
    },
    {
      "id": 22,
      "src": 9,
      "dst": 13,
      "length": 235.8713173227889
    },
    {
      "id": 23,
      "src": 13,
      "dst": 9,
      "length": 235.8713173227889
    },
    {
      "id": 24,
      "src": 10,
      "dst": 11,
      "length": 589.2508599924295
    },
    {
      "id": 25,
      "src": 11,
      "dst": 10,
      "length": 589.2508599924295
    },
    {
      "id": 26,
      "src": 10,
      "dst": 13,
      "length": 413.8389675135418
    },
    {
      "id": 27,
      "src": 13,
      "dst": 10,
      "length": 413.8389675135418
    },
    {
      "id": 28,
      "src": 11,
      "dst": 17,
      "length": 424.175933883086
    },
    {
      "id": 29,
      "src": 17,
      "dst": 11,
      "length": 424.175933883086
    },
    {
      "id": 30,
      "src": 11,
      "dst": 18,
      "length": 195.388303552465
    },
    {
      "id": 31,
      "src": 18,
      "dst": 11,
      "length": 195.388303552465
    },
    {
      "id": 32,
      "src": 11,
      "dst": 19,
      "length": 108.5465409911054
    },
    {
      "id": 33,
      "src": 19,
      "dst": 11,
      "length": 108.5465409911054
    },
    {
      "id": 34,
      "src": 11,
      "dst": 20,
      "length": 306.8625058255422
    },
    {
      "id": 35,
      "src": 20,
      "dst": 11,
      "length": 306.8625058255422
    },
    {
      "id": 36,
      "src": 11,
      "dst": 21,
      "length": 168.1761860997829
    },
    {
      "id": 37,
      "src": 21,
      "dst": 11,
      "length": 168.1761860997829
    },
    {
      "id": 38,
      "src": 11,
      "dst": 23,
      "length": 463.7727051434647
    },
    {
      "id": 39,
      "src": 23,
      "dst": 11,
      "length": 463.7727051434647
    },
    {
      "id": 40,
      "src": 14,
      "dst": 23,
      "length": 144.1831991731319
    },
    {
      "id": 41,
      "src": 23,
      "dst": 14,
      "length": 144.1831991731319
    },
    {
      "id": 42,
      "src": 16,
      "dst": 17,
      "length": 171.6753296158936
    },
    {
      "id": 43,
      "src": 17,
      "dst": 16,
      "length": 171.6753296158936
    },
    {
      "id": 44,
      "src": 21,
      "dst": 22,
      "length": 164.130662797804
    },
    {
      "id": 45,
      "src": 22,
      "dst": 21,
      "length": 164.130662797804
    }
  ]
}
