{
  "alias": "GEANT",
  "name": "TOP_35_GEANT",
  "nodes": [
    {
      "id": 0
    },
    {
      "id": 1
    },
    {
      "id": 2
    },
    {
      "id": 3
    },
    {
      "id": 4
    },
    {
      "id": 5
    },
    {
      "id": 6
    },
    {
      "id": 7
    },
    {
      "id": 8
    },
    {
      "id": 9
    },
    {
      "id": 10
    },
    {
      "id": 11
    },
    {
      "id": 12
    },
    {
      "id": 13
    },
    {
      "id": 14
    },
    {
      "id": 15
    },
    {
      "id": 16
    },
    {
      "id": 17
    },
    {
      "id": 18
    },
    {
      "id": 19
    },
    {
      "id": 20
    },
    {
      "id": 21
    }
  ],
  "links": [
    {
      "id": 0,
      "src": 0,
      "dst": 2,
      "length": 1205.741718697376
    },
    {
      "id": 1,
      "src": 2,
      "dst": 0,
      "length": 1205.741718697376
    },
    {
      "id": 2,
      "src": 0,
      "dst": 4,
      "length": 896.1689368748143
    },
    {
      "id": 3,
      "src": 4,
      "dst": 0,
      "length": 896.1689368748143
    },
    {
      "id": 4,
      "src": 0,
      "dst": 9,
      "length": 326.792609366545
    },
    {
      "id": 5,
      "src": 9,
      "dst": 0,
      "length": 326.792609366545
    },
    {
      "id": 6,
      "src": 0,
      "dst": 15,
      "length": 8494.167120778287
    },
    {
      "id": 7,
      "src": 15,
      "dst": 0,
      "length": 8494.167120778287
    },
    {
      "id": 8,
      "src": 0,
      "dst": 19,
      "length": 416.2042271506733
    },
    {
      "id": 9,
      "src": 19,
      "dst": 0,
      "length": 416.2042271506733
    },
    {
      "id": 10,
      "src": 1,
      "dst": 6,
      "length": 395.5671921820349
    },
    {
      "id": 11,
      "src": 6,
      "dst": 1,
      "length": 395.5671921820349
    },
    {
      "id": 12,
      "src": 1,
      "dst": 13,
      "length": 280.095250485013
    },
    {
      "id": 13,
      "src": 13,
      "dst": 1,
      "length": 280.095250485013
    },
    {
      "id": 14,
      "src": 1,
      "dst": 14,
      "length": 253.748818411639
    },
    {
      "id": 15,
      "src": 14,
      "dst": 1,
      "length": 253.748818411639
    },
    {
      "id": 16,
      "src": 2,
      "dst": 6,
      "length": 614.5443962857513
    },
    {
      "id": 17,
      "src": 6,
      "dst": 2,
      "length": 614.5443962857513
    },
    {
      "id": 18,
      "src": 2,
      "dst": 12,
      "length": 375.2774972722834
    },
    {
      "id": 19,
      "src": 12,
      "dst": 2,
      "length": 375.2774972722834
    },
    {
      "id": 20,
      "src": 3,
      "dst": 4,
      "length": 615.985650719161
    },
    {
      "id": 21,
      "src": 4,
      "dst": 3,
      "length": 615.985650719161
    },
    {
      "id": 22,
      "src": 3,
      "dst": 16,
      "length": 463.2422772840073
    },
    {
      "id": 23,
      "src": 16,
      "dst": 3,
      "length": 463.2422772840073
    },
    {
      "id": 24,
      "src": 3,
      "dst": 20,
      "length": 434.9231408588021
    },
    {
      "id": 25,
      "src": 20,
      "dst": 3,
      "length": 434.9231408588021
    },
    {
      "id": 26,
      "src": 4,
      "dst": 6,
      "length": 717.2335947676761
    },
    {
      "id": 27,
      "src": 6,
      "dst": 4,
      "length": 717.2335947676761
    },
    {
      "id": 28,
      "src": 4,
      "dst": 7,
      "length": 2240.980605010167
    },
    {
      "id": 29,
      "src": 7,
      "dst": 4,
      "length": 2240.980605010167
    },
    {
      "id": 30,
      "src": 4,
      "dst": 10,
      "length": 1500.0
    },
    {
      "id": 31,
      "src": 10,
      "dst": 4,
      "length": 1500.0
    },
    {
      "id": 32,
      "src": 4,
      "dst": 12,
      "length": 777.315099448178
    },
    {
      "id": 33,
      "src": 12,
      "dst": 4,
      "length": 777.315099448178
    },
    {
      "id": 34,
      "src": 4,
      "dst": 14,
      "length": 537.4556978209507
    },
    {
      "id": 35,
      "src": 14,
      "dst": 4,
      "length": 537.4556978209507
    },
    {
      "id": 36,
      "src": 4,
      "dst": 18,
      "length": 1500.0
    },
    {
      "id": 37,
      "src": 18,
      "dst": 4,
      "length": 1500.0
    },
    {
      "id": 38,
      "src": 5,
      "dst": 6,
      "length": 1500.0
    },
    {
      "id": 39,
      "src": 6,
      "dst": 5,
      "length": 1500.0
    },
    {
      "id": 40,
      "src": 5,
      "dst": 12,
      "length": 1500.0
    },
    {
      "id": 41,
      "src": 12,
      "dst": 5,
      "length": 1500.0
    },
    {
      "id": 42,
      "src": 5,
      "dst": 17,
      "length": 754.3780747471078
    },
    {
      "id": 43,
      "src": 17,
      "dst": 5,
      "length": 754.3780747471078
    },
    {
      "id": 44,
      "src": 6,
      "dst": 13,
      "length": 430.2917638658975
    },
    {
      "id": 45,
      "src": 13,
      "dst": 6,
      "length": 430.2917638658975
    },
    {
      "id": 46,
      "src": 6,
      "dst": 21,
      "length": 515.36158679831
    },
    {
      "id": 47,
      "src": 21,
      "dst": 6,
      "length": 515.36158679831
    },
    {
      "id": 48,
      "src": 7,
      "dst": 12,
      "length": 1815.420595779476
    },
    {
      "id": 49,
      "src": 12,
      "dst": 7,
      "length": 1815.420595779476
    },
    {
      "id": 50,
      "src": 8,
      "dst": 9,
      "length": 455.8481192958354
    },
    {
      "id": 51,
      "src": 9,
      "dst": 8,
      "length": 455.8481192958354
    },
    {
      "id": 52,
      "src": 8,
      "dst": 19,
      "length": 173.2635674625123
    },
    {
      "id": 53,
      "src": 19,
      "dst": 8,
      "length": 173.2635674625123
    },
    {
      "id": 54,
      "src": 9,
      "dst": 20,
      "length": 245.5911295353906
    },
    {
      "id": 55,
      "src": 20,
      "dst": 9,
      "length": 245.5911295353906
    },
    {
      "id": 56,
      "src": 10,
      "dst": 21,
      "length": 694.1747825761532
    },
    {
      "id": 57,
      "src": 21,
      "dst": 10,
      "length": 694.1747825761532
    },
    {
      "id": 58,
      "src": 11,
      "dst": 12,
      "length": 3319.590434051195
    },
    {
      "id": 59,
      "src": 12,
      "dst": 11,
      "length": 3319.590434051195
    },
    {
      "id": 60,
      "src": 11,
      "dst": 14,
      "length": 4116.059850695134
    },
    {
      "id": 61,
      "src": 14,
      "dst": 11,
      "length": 4116.059850695134
    },
    {
      "id": 62,
      "src": 14,
      "dst": 21,
      "length": 538.6083143873095
    },
    {
      "id": 63,
      "src": 21,
      "dst": 14,
      "length": 538.6083143873095
    },
    {
      "id": 64,
      "src": 15,
      "dst": 21,
      "length": 6961.479107534074
    },
    {
      "id": 65,
      "src": 21,
      "dst": 15,
      "length": 6961.479107534074
    },
    {
      "id": 66,
      "src": 16,
      "dst": 18,
      "length": 1165.404461338919
    },
    {
      "id": 67,
      "src": 18,
      "dst": 16,
      "length": 1165.404461338919
    },
    {
      "id": 68,
      "src": 17,
      "dst": 21,
      "length": 1983.225004686776
    },
    {
      "id": 69,
      "src": 21,
      "dst": 17,
      "length": 1983.225004686776
    },
    {
      "id": 70,
      "src": 18,
      "dst": 21,
      "length": 1781.016899491856
    },
    {
      "id": 71,
      "src": 21,
      "dst": 18,
      "length": 1781.016899491856
    }
  ]
}
