{
  "alias": "ISTAR",
  "name": "TOP_52_ISTAR",
  "nodes": [
    {
      "id": 0
    },
    {
      "id": 1
    },
    {
      "id": 2
    },
    {
      "id": 3
    },
    {
      "id": 4
    },
    {
      "id": 5
    },
    {
      "id": 6
    },
    {
      "id": 7
    },
    {
      "id": 8
    },
    {
      "id": 9
    },
    {
      "id": 10
    },
    {
      "id": 11
    },
    {
      "id": 12
    },
    {
      "id": 13
    },
    {
      "id": 14
    },
    {
      "id": 15
    },
    {
      "id": 16
    },
    {
      "id": 17
    },
    {
      "id": 18
    }
  ],
  "links": [
    {
      "id": 0,
      "src": 0,
      "dst": 1,
      "length": 350.1389724135474
    },
    {
      "id": 1,
      "src": 1,
      "dst": 0,
      "length": 350.1389724135474
    },
    {
      "id": 2,
      "src": 0,
      "dst": 3,
      "length": 1026.361517307967
    },
    {
      "id": 3,
      "src": 3,
      "dst": 0,
      "length": 1026.361517307967
    },
    {
      "id": 4,
      "src": 0,
      "dst": 10,
      "length": 755.0357670265992
    },
    {
      "id": 5,
      "src": 10,
      "dst": 0,
      "length": 755.0357670265992
    },
    {
      "id": 6,
      "src": 0,
      "dst": 5,
      "length": 198.5751791544305
    },
    {
      "id": 7,
      "src": 5,
      "dst": 0,
      "length": 198.5751791544305
    },
    {
      "id": 8,
      "src": 0,
      "dst": 17,
      "length": 247.4032001412376
    },
    {
      "id": 9,
      "src": 17,
      "dst": 0,
      "length": 247.4032001412376
    },
    {
      "id": 10,
      "src": 2,
      "dst": 10,
      "length": 250.2531794080375
    },
    {
      "id": 11,
      "src": 10,
      "dst": 2,
      "length": 250.2531794080375
    },
    {
      "id": 12,
      "src": 3,
      "dst": 4,
      "length": 284.3799353856231
    },
    {
      "id": 13,
      "src": 4,
      "dst": 3,
      "length": 284.3799353856231
    },
    {
      "id": 14,
      "src": 3,
      "dst": 6,
      "length": 204.9111545304429
    },
    {
      "id": 15,
      "src": 6,
      "dst": 3,
      "length": 204.9111545304429
    },
    {
      "id": 16,
      "src": 4,
      "dst": 7,
      "length": 468.3506272246442
    },
    {
      "id": 17,
      "src": 7,
      "dst": 4,
      "length": 468.3506272246442
    },
    {
      "id": 18,
      "src": 4,
      "dst": 8,
      "length": 333.9767249411377
    },
    {
      "id": 19,
      "src": 8,
      "dst": 4,
      "length": 333.9767249411377
    },
    {
      "id": 20,
      "src": 9,
      "dst": 12,
      "length": 139.4958300540092
    },
    {
      "id": 21,
      "src": 12,
      "dst": 9,
      "length": 139.4958300540092
    },
    {
      "id": 22,
      "src": 10,
      "dst": 11,
      "length": 101.3005820479409
    },
    {
      "id": 23,
      "src": 11,
      "dst": 10,
      "length": 101.3005820479409
    },
    {
      "id": 24,
      "src": 10,
      "dst": 17,
      "length": 526.0580396293944
    },
    {
      "id": 25,
      "src": 17,
      "dst": 10,
      "length": 526.0580396293944
    },
    {
      "id": 26,
      "src": 10,
      "dst": 18,
      "length": 134.7019718699122
    },
    {
      "id": 27,
      "src": 18,
      "dst": 10,
      "length": 134.7019718699122
    },
    {
      "id": 28,
      "src": 12,
      "dst": 13,
      "length": 1009.95690485004
    },
    {
      "id": 29,
      "src": 13,
      "dst": 12,
      "length": 1009.95690485004
    },
    {
      "id": 30,
      "src": 12,
      "dst": 17,
      "length": 4424.968959600237
    },
    {
      "id": 31,
      "src": 17,
      "dst": 12,
      "length": 4424.968959600237
    },
    {
      "id": 32,
      "src": 13,
      "dst": 14,
      "length": 421.7445112294374
    },
    {
      "id": 33,
      "src": 14,
      "dst": 13,
      "length": 421.7445112294374
    },
    {
      "id": 34,
      "src": 13,
      "dst": 15,
      "length": 262.5774509897452
    },
    {
      "id": 35,
      "src": 15,
      "dst": 13,
      "length": 262.5774509897452
    },
    {
      "id": 36,
      "src": 16,
      "dst": 17,
      "length": 2094.139590166251
    },
    {
      "id": 37,
      "src": 17,
      "dst": 16,
      "length": 2094.139590166251
    }
  ]
}
