{
  "alias": "SPIRALIGHT",
  "name": "TOP_100_SPIRALIGHT",
  "nodes": [
    {
      "id": 0
    },
    {
      "id": 1
    },
    {
      "id": 2
    },
    {
      "id": 3
    },
    {
      "id": 4
    },
    {
      "id": 5
    },
    {
      "id": 6
    },
    {
      "id": 7
    },
    {
      "id": 8
    },
    {
      "id": 9
    },
    {
      "id": 10
    },
    {
      "id": 11
    },
    {
      "id": 12
    },
    {
      "id": 13
    },
    {
      "id": 14
    }
  ],
  "links": [
    {
      "id": 0,
      "src": 0,
      "dst": 3,
      "length": 39.33857400442843
    },
    {
      "id": 1,
      "src": 3,
      "dst": 0,
      "length": 39.33857400442843
    },
    {
      "id": 2,
      "src": 0,
      "dst": 4,
      "length": 75.860016937924
    },
    {
      "id": 3,
      "src": 4,
      "dst": 0,
      "length": 75.860016937924
    },
    {
      "id": 4,
      "src": 1,
      "dst": 2,
      "length": 68.9249489242323
    },
    {
      "id": 5,
      "src": 2,
      "dst": 1,
      "length": 68.9249489242323
    },
    {
      "id": 6,
      "src": 1,
      "dst": 4,
      "length": 165.2065935025056
    },
    {
      "id": 7,
      "src": 4,
      "dst": 1,
      "length": 165.2065935025056
    },
    {
      "id": 8,
      "src": 2,
      "dst": 5,
      "length": 79.92983480781709
    },
    {
      "id": 9,
      "src": 5,
      "dst": 2,
      "length": 79.92983480781709
    },
    {
      "id": 10,
      "src": 3,
      "dst": 5,
      "length": 142.9780858880039
    },
    {
      "id": 11,
      "src": 5,
      "dst": 3,
      "length": 142.9780858880039
    },
    {
      "id": 12,
      "src": 5,
      "dst": 6,
      "length": 176.5788615413109
    },
    {
      "id": 13,
      "src": 6,
      "dst": 5,
      "length": 176.5788615413109
    },
    {
      "id": 14,
      "src": 5,
      "dst": 14,
      "length": 94.11399976081071
    },
    {
      "id": 15,
      "src": 14,
      "dst": 5,
      "length": 94.11399976081071
    },
    {
      "id": 16,
      "src": 6,
      "dst": 8,
      "length": 208.6732898997296
    },
    {
      "id": 17,
      "src": 8,
      "dst": 6,
      "length": 208.6732898997296
    },
    {
      "id": 18,
      "src": 7,
      "dst": 8,
      "length": 209.8743549933172
    },
    {
      "id": 19,
      "src": 8,
      "dst": 7,
      "length": 209.8743549933172
    },
    {
      "id": 20,
      "src": 7,
      "dst": 9,
      "length": 428.3236075781989
    },
    {
      "id": 21,
      "src": 9,
      "dst": 7,
      "length": 428.3236075781989
    },
    {
      "id": 22,
      "src": 9,
      "dst": 10,
      "length": 204.3696485906607
    },
    {
      "id": 23,
      "src": 10,
      "dst": 9,
      "length": 204.3696485906607
    },
    {
      "id": 24,
      "src": 10,
      "dst": 11,
      "length": 64.44807162855902
    },
    {
      "id": 25,
      "src": 11,
      "dst": 10,
      "length": 64.44807162855902
    },
    {
      "id": 26,
      "src": 11,
      "dst": 12,
      "length": 42.52913763533532
    },
    {
      "id": 27,
      "src": 12,
      "dst": 11,
      "length": 42.52913763533532
    },
    {
      "id": 28,
      "src": 12,
      "dst": 13,
      "length": 43.39577057780664
    },
    {
      "id": 29,
      "src": 13,
      "dst": 12,
      "length": 43.39577057780664
    },
    {
      "id": 30,
      "src": 13,
      "dst": 14,
      "length": 70.75718093948329
    },
    {
      "id": 31,
      "src": 14,
      "dst": 13,
      "length": 70.75718093948329
    }
  ]
}
