{
  "alias": "HIBERNIAUS",
  "name": "TOP_47_HIBERNIAUS",
  "nodes": [
    {
      "id": 0
    },
    {
      "id": 1
    },
    {
      "id": 2
    },
    {
      "id": 3
    },
    {
      "id": 4
    },
    {
      "id": 5
    },
    {
      "id": 6
    },
    {
      "id": 7
    },
    {
      "id": 8
    },
    {
      "id": 9
    },
    {
      "id": 10
    },
    {
      "id": 11
    },
    {
      "id": 12
    },
    {
      "id": 13
    },
    {
      "id": 14
    },
    {
      "id": 15
    },
    {
      "id": 16
    },
    {
      "id": 17
    },
    {
      "id": 18
    },
    {
      "id": 19
    }
  ],
  "links": [
    {
      "id": 0,
      "src": 0,
      "dst": 3,
      "length": 397.6649920225643
    },
    {
      "id": 1,
      "src": 3,
      "dst": 0,
      "length": 397.6649920225643
    },
    {
      "id": 2,
      "src": 0,
      "dst": 12,
      "length": 988.8431894766425
    },
    {
      "id": 3,
      "src": 12,
      "dst": 0,
      "length": 988.8431894766425
    },
    {
      "id": 4,
      "src": 0,
      "dst": 13,
      "length": 277.6478760498783
    },
    {
      "id": 5,
      "src": 13,
      "dst": 0,
      "length": 277.6478760498783
    },
    {
      "id": 6,
      "src": 1,
      "dst": 9,
      "length": 193.5165266446945
    },
    {
      "id": 7,
      "src": 9,
      "dst": 1,
      "length": 193.5165266446945
    },
    {
      "id": 8,
      "src": 1,
      "dst": 2,
      "length": 182.2082908548479
    },
    {
      "id": 9,
      "src": 2,
      "dst": 1,
      "length": 182.2082908548479
    },
    {
      "id": 10,
      "src": 1,
      "dst": 3,
      "length": 336.1009376453503
    },
    {
      "id": 11,
      "src": 3,
      "dst": 1,
      "length": 336.1009376453503
    },
    {
      "id": 12,
      "src": 2,
      "dst": 3,
      "length": 510.74493402578
    },
    {
      "id": 13,
      "src": 3,
      "dst": 2,
      "length": 510.74493402578
    },
    {
      "id": 14,
      "src": 2,
      "dst": 10,
      "length": 70.79952412600834
    },
    {
      "id": 15,
      "src": 10,
      "dst": 2,
      "length": 70.79952412600834
    },
    {
      "id": 16,
      "src": 2,
      "dst": 9,
      "length": 20.83436718327859
    },
    {
      "id": 17,
      "src": 9,
      "dst": 2,
      "length": 20.83436718327859
    },
    {
      "id": 18,
      "src": 3,
      "dst": 6,
      "length": 44.18098870812758
    },
    {
      "id": 19,
      "src": 6,
      "dst": 3,
      "length": 44.18098870812758
    },
    {
      "id": 20,
      "src": 4,
      "dst": 5,
      "length": 312.0079821457963
    },
    {
      "id": 21,
      "src": 5,
      "dst": 4,
      "length": 312.0079821457963
    },
    {
      "id": 22,
      "src": 4,
      "dst": 7,
      "length": 336.2521540699969
    },
    {
      "id": 23,
      "src": 7,
      "dst": 4,
      "length": 336.2521540699969
    },
    {
      "id": 24,
      "src": 5,
      "dst": 8,
      "length": 546.8613702582421
    },
    {
      "id": 25,
      "src": 8,
      "dst": 5,
      "length": 546.8613702582421
    },
    {
      "id": 26,
      "src": 6,
      "dst": 7,
      "length": 233.0775281483698
    },
    {
      "id": 27,
      "src": 7,
      "dst": 6,
      "length": 233.0775281483698
    },
    {
      "id": 28,
      "src": 9,
      "dst": 17,
      "length": 325.0720000910152
    },
    {
      "id": 29,
      "src": 17,
      "dst": 9,
      "length": 325.0720000910152
    },
    {
      "id": 30,
      "src": 9,
      "dst": 11,
      "length": 82.03035170425309
    },
    {
      "id": 31,
      "src": 11,
      "dst": 9,
      "length": 82.03035170425309
    },
    {
      "id": 32,
      "src": 10,
      "dst": 11,
      "length": 27.87704634020835
    },
    {
      "id": 33,
      "src": 11,
      "dst": 10,
      "length": 27.87704634020835
    },
    {
      "id": 34,
      "src": 11,
      "dst": 18,
      "length": 378.2724731274459
    },
    {
      "id": 35,
      "src": 18,
      "dst": 11,
      "length": 378.2724731274459
    },
    {
      "id": 36,
      "src": 12,
      "dst": 13,
      "length": 743.4071200946746
    },
    {
      "id": 37,
      "src": 13,
      "dst": 12,
      "length": 743.4071200946746
    },
    {
      "id": 38,
      "src": 13,
      "dst": 14,
      "length": 418.5080080999496
    },
    {
      "id": 39,
      "src": 14,
      "dst": 13,
      "length": 418.5080080999496
    },
    {
      "id": 40,
      "src": 14,
      "dst": 15,
      "length": 150.1652468643198
    },
    {
      "id": 41,
      "src": 15,
      "dst": 14,
      "length": 150.1652468643198
    },
    {
      "id": 42,
      "src": 14,
      "dst": 17,
      "length": 628.0712841529555
    },
    {
      "id": 43,
      "src": 17,
      "dst": 14,
      "length": 628.0712841529555
    },
    {
      "id": 44,
      "src": 15,
      "dst": 16,
      "length": 755.0357670265992
    },
    {
      "id": 45,
      "src": 16,
      "dst": 15,
      "length": 755.0357670265992
    },
    {
      "id": 46,
      "src": 16,
      "dst": 17,
      "length": 477.4605770094612
    },
    {
      "id": 47,
      "src": 17,
      "dst": 16,
      "length": 477.4605770094612
    },
    {
      "id": 48,
      "src": 16,
      "dst": 19,
      "length": 1187.999858185761
    },
    {
      "id": 49,
      "src": 19,
      "dst": 16,
      "length": 1187.999858185761
    },
    {
      "id": 50,
      "src": 17,
      "dst": 18,
      "length": 335.4884708932951
    },
    {
      "id": 51,
      "src": 18,
      "dst": 17,
      "length": 335.4884708932951
    },
    {
      "id": 52,
      "src": 18,
      "dst": 19,
      "length": 982.8418925334275
    },
    {
      "id": 53,
      "src": 19,
      "dst": 18,
      "length": 982.8418925334275
    }
  ]
}
