{
  "alias": "OPTUNETSWEDEN",
  "name": "TOP_76_OPTUNETSWEDEN",
  "nodes": [
    {
      "id": 0
    },
    {
      "id": 1
    },
    {
      "id": 2
    },
    {
      "id": 3
    },
    {
      "id": 4
    },
    {
      "id": 5
    },
    {
      "id": 6
    },
    {
      "id": 7
    },
    {
      "id": 8
    },
    {
      "id": 9
    },
    {
      "id": 10
    },
    {
      "id": 11
    },
    {
      "id": 12
    },
    {
      "id": 13
    },
    {
      "id": 14
    },
    {
      "id": 15
    },
    {
      "id": 16
    },
    {
      "id": 17
    },
    {
      "id": 18
    },
    {
      "id": 19
    },
    {
      "id": 20
    },
    {
      "id": 21
    },
    {
      "id": 22
    },
    {
      "id": 23
    },
    {
      "id": 24
    }
  ],
  "links": [
    {
      "id": 0,
      "src": 0,
      "dst": 4,
      "length": 190.0960808400053
    },
    {
      "id": 1,
      "src": 4,
      "dst": 0,
      "length": 190.0960808400053
    },
    {
      "id": 2,
      "src": 0,
      "dst": 6,
      "length": 86.74341799687855
    },
    {
      "id": 3,
      "src": 6,
      "dst": 0,
      "length": 86.74341799687855
    },
    {
      "id": 4,
      "src": 0,
      "dst": 7,
      "length": 100.2746698658031
    },
    {
      "id": 5,
      "src": 7,
      "dst": 0,
      "length": 100.2746698658031
    },
    {
      "id": 6,
      "src": 1,
      "dst": 2,
      "length": 188.4095708659947
    },
    {
      "id": 7,
      "src": 2,
      "dst": 1,
      "length": 188.4095708659947
    },
    {
      "id": 8,
      "src": 1,
      "dst": 6,
      "length": 137.3740662255246
    },
    {
      "id": 9,
      "src": 6,
      "dst": 1,
      "length": 137.3740662255246
    },
    {
      "id": 10,
      "src": 1,
      "dst": 7,
      "length": 137.4396981416263
    },
    {
      "id": 11,
      "src": 7,
      "dst": 1,
      "length": 137.4396981416263
    },
    {
      "id": 12,
      "src": 2,
      "dst": 23,
      "length": 203.0177338605977
    },
    {
      "id": 13,
      "src": 23,
      "dst": 2,
      "length": 203.0177338605977
    },
    {
      "id": 14,
      "src": 2,
      "dst": 3,
      "length": 145.9610522942691
    },
    {
      "id": 15,
      "src": 3,
      "dst": 2,
      "length": 145.9610522942691
    },
    {
      "id": 16,
      "src": 2,
      "dst": 17,
      "length": 1253.714379773383
    },
    {
      "id": 17,
      "src": 17,
      "dst": 2,
      "length": 1253.714379773383
    },
    {
      "id": 18,
      "src": 3,
      "dst": 7,
      "length": 210.694581270405
    },
    {
      "id": 19,
      "src": 7,
      "dst": 3,
      "length": 210.694581270405
    },
    {
      "id": 20,
      "src": 4,
      "dst": 10,
      "length": 164.5478734830161
    },
    {
      "id": 21,
      "src": 10,
      "dst": 4,
      "length": 164.5478734830161
    },
    {
      "id": 22,
      "src": 5,
      "dst": 16,
      "length": 260.5348643627447
    },
    {
      "id": 23,
      "src": 16,
      "dst": 5,
      "length": 260.5348643627447
    },
    {
      "id": 24,
      "src": 5,
      "dst": 8,
      "length": 166.7174780120039
    },
    {
      "id": 25,
      "src": 8,
      "dst": 5,
      "length": 166.7174780120039
    },
    {
      "id": 26,
      "src": 8,
      "dst": 9,
      "length": 163.7588213038351
    },
    {
      "id": 27,
      "src": 9,
      "dst": 8,
      "length": 163.7588213038351
    },
    {
      "id": 28,
      "src": 9,
      "dst": 10,
      "length": 245.0906239697914
    },
    {
      "id": 29,
      "src": 10,
      "dst": 9,
      "length": 245.0906239697914
    },
    {
      "id": 30,
      "src": 9,
      "dst": 13,
      "length": 145.3156585583322
    },
    {
      "id": 31,
      "src": 13,
      "dst": 9,
      "length": 145.3156585583322
    },
    {
      "id": 32,
      "src": 10,
      "dst": 15,
      "length": 24.6185530101705
    },
    {
      "id": 33,
      "src": 15,
      "dst": 10,
      "length": 24.6185530101705
    },
    {
      "id": 34,
      "src": 11,
      "dst": 12,
      "length": 108.6370977105624
    },
    {
      "id": 35,
      "src": 12,
      "dst": 11,
      "length": 108.6370977105624
    },
    {
      "id": 36,
      "src": 11,
      "dst": 15,
      "length": 129.1553528994795
    },
    {
      "id": 37,
      "src": 15,
      "dst": 11,
      "length": 129.1553528994795
    },
    {
      "id": 38,
      "src": 12,
      "dst": 13,
      "length": 125.2771429335356
    },
    {
      "id": 39,
      "src": 13,
      "dst": 12,
      "length": 125.2771429335356
    },
    {
      "id": 40,
      "src": 14,
      "dst": 16,
      "length": 282.8790813503142
    },
    {
      "id": 41,
      "src": 16,
      "dst": 14,
      "length": 282.8790813503142
    },
    {
      "id": 42,
      "src": 16,
      "dst": 17,
      "length": 1154.573279465749
    },
    {
      "id": 43,
      "src": 17,
      "dst": 16,
      "length": 1154.573279465749
    },
    {
      "id": 44,
      "src": 16,
      "dst": 24,
      "length": 94.59605471963164
    },
    {
      "id": 45,
      "src": 24,
      "dst": 16,
      "length": 94.59605471963164
    },
    {
      "id": 46,
      "src": 18,
      "dst": 19,
      "length": 399.6140407572479
    },
    {
      "id": 47,
      "src": 19,
      "dst": 18,
      "length": 399.6140407572479
    },
    {
      "id": 48,
      "src": 19,
      "dst": 20,
      "length": 322.4443218961811
    },
    {
      "id": 49,
      "src": 20,
      "dst": 19,
      "length": 322.4443218961811
    },
    {
      "id": 50,
      "src": 20,
      "dst": 21,
      "length": 327.1913618719075
    },
    {
      "id": 51,
      "src": 21,
      "dst": 20,
      "length": 327.1913618719075
    },
    {
      "id": 52,
      "src": 21,
      "dst": 22,
      "length": 286.6426397341182
    },
    {
      "id": 53,
      "src": 22,
      "dst": 21,
      "length": 286.6426397341182
    },
    {
      "id": 54,
      "src": 22,
      "dst": 23,
      "length": 143.1556159924878
    },
    {
      "id": 55,
      "src": 23,
      "dst": 22,
      "length": 143.1556159924878
    },
    {
      "id": 56,
      "src": 22,
      "dst": 24,
      "length": 142.339911379905
    },
    {
      "id": 57,
      "src": 24,
      "dst": 22,
      "length": 142.339911379905
    }
  ]
}
