{
  "alias": "POLSKA",
  "name": "TOP_82_POLSKA",
  "nodes": [
    {
      "id": 0
    },
    {
      "id": 1
    },
    {
      "id": 2
    },
    {
      "id": 3
    },
    {
      "id": 4
    },
    {
      "id": 5
    },
    {
      "id": 6
    },
    {
      "id": 7
    },
    {
      "id": 8
    },
    {
      "id": 9
    },
    {
      "id": 10
    },
    {
      "id": 11
    }
  ],
  "links": [
    {
      "id": 0,
      "src": 0,
      "dst": 10,
      "length": 410.7744042567559
    },
    {
      "id": 1,
      "src": 10,
      "dst": 0,
      "length": 410.7744042567559
    },
    {
      "id": 2,
      "src": 0,
      "dst": 2,
      "length": 243.9034925586963
    },
    {
      "id": 3,
      "src": 2,
      "dst": 0,
      "length": 243.9034925586963
    },
    {
      "id": 4,
      "src": 0,
      "dst": 5,
      "length": 481.1108566271961
    },
    {
      "id": 5,
      "src": 5,
      "dst": 0,
      "length": 481.1108566271961
    },
    {
      "id": 6,
      "src": 1,
      "dst": 2,
      "length": 255.5770705699139
    },
    {
      "id": 7,
      "src": 2,
      "dst": 1,
      "length": 255.5770705699139
    },
    {
      "id": 8,
      "src": 1,
      "dst": 7,
      "length": 161.1319834866405
    },
    {
      "id": 9,
      "src": 7,
      "dst": 1,
      "length": 161.1319834866405
    },
    {
      "id": 10,
      "src": 1,
      "dst": 10,
      "length": 347.7170275587544
    },
    {
      "id": 11,
      "src": 10,
      "dst": 1,
      "length": 347.7170275587544
    },
    {
      "id": 12,
      "src": 2,
      "dst": 9,
      "length": 206.5017098295303
    },
    {
      "id": 13,
      "src": 9,
      "dst": 2,
      "length": 206.5017098295303
    },
    {
      "id": 14,
      "src": 3,
      "dst": 4,
      "length": 118.009331406665
    },
    {
      "id": 15,
      "src": 4,
      "dst": 3,
      "length": 118.009331406665
    },
    {
      "id": 16,
      "src": 3,
      "dst": 6,
      "length": 241.8510106704026
    },
    {
      "id": 17,
      "src": 6,
      "dst": 3,
      "length": 241.8510106704026
    },
    {
      "id": 18,
      "src": 3,
      "dst": 11,
      "length": 241.0147228136016
    },
    {
      "id": 19,
      "src": 11,
      "dst": 3,
      "length": 241.0147228136016
    },
    {
      "id": 20,
      "src": 4,
      "dst": 8,
      "length": 225.1379758967965
    },
    {
      "id": 21,
      "src": 8,
      "dst": 4,
      "length": 225.1379758967965
    },
    {
      "id": 22,
      "src": 4,
      "dst": 10,
      "length": 387.8574867354514
    },
    {
      "id": 23,
      "src": 10,
      "dst": 4,
      "length": 387.8574867354514
    },
    {
      "id": 24,
      "src": 5,
      "dst": 8,
      "length": 531.804038576357
    },
    {
      "id": 25,
      "src": 8,
      "dst": 5,
      "length": 531.804038576357
    },
    {
      "id": 26,
      "src": 5,
      "dst": 10,
      "length": 260.1554864729655
    },
    {
      "id": 27,
      "src": 10,
      "dst": 5,
      "length": 260.1554864729655
    },
    {
      "id": 28,
      "src": 6,
      "dst": 10,
      "length": 184.4117882015071
    },
    {
      "id": 29,
      "src": 10,
      "dst": 6,
      "length": 184.4117882015071
    },
    {
      "id": 30,
      "src": 6,
      "dst": 11,
      "length": 278.712944604
    },
    {
      "id": 31,
      "src": 11,
      "dst": 6,
      "length": 278.712944604
    },
    {
      "id": 32,
      "src": 7,
      "dst": 9,
      "length": 285.227139412663
    },
    {
      "id": 33,
      "src": 9,
      "dst": 7,
      "length": 285.227139412663
    },
    {
      "id": 34,
      "src": 7,
      "dst": 11,
      "length": 217.0757821935017
    },
    {
      "id": 35,
      "src": 11,
      "dst": 7,
      "length": 217.0757821935017
    }
  ]
}
