{
  "alias": "SAGO",
  "name": "TOP_96_SAGO",
  "nodes": [
    {
      "id": 0
    },
    {
      "id": 1
    },
    {
      "id": 2
    },
    {
      "id": 3
    },
    {
      "id": 4
    },
    {
      "id": 5
    },
    {
      "id": 6
    },
    {
      "id": 7
    },
    {
      "id": 8
    },
    {
      "id": 9
    },
    {
      "id": 10
    },
    {
      "id": 11
    },
    {
      "id": 12
    },
    {
      "id": 13
    },
    {
      "id": 14
    },
    {
      "id": 15
    },
    {
      "id": 16
    },
    {
      "id": 17
    }
  ],
  "links": [
    {
      "id": 0,
      "src": 0,
      "dst": 1,
      "length": 112.9130335236984
    },
    {
      "id": 1,
      "src": 1,
      "dst": 0,
      "length": 112.9130335236984
    },
    {
      "id": 2,
      "src": 0,
      "dst": 4,
      "length": 128.6622981191926
    },
    {
      "id": 3,
      "src": 4,
      "dst": 0,
      "length": 128.6622981191926
    },
    {
      "id": 4,
      "src": 1,
      "dst": 16,
      "length": 93.14768168607968
    },
    {
      "id": 5,
      "src": 16,
      "dst": 1,
      "length": 93.14768168607968
    },
    {
      "id": 6,
      "src": 2,
      "dst": 3,
      "length": 90.14377938900955
    },
    {
      "id": 7,
      "src": 3,
      "dst": 2,
      "length": 90.14377938900955
    },
    {
      "id": 8,
      "src": 2,
      "dst": 5,
      "length": 111.4326474233612
    },
    {
      "id": 9,
      "src": 5,
      "dst": 2,
      "length": 111.4326474233612
    },
    {
      "id": 10,
      "src": 3,
      "dst": 17,
      "length": 123.502526239912
    },
    {
      "id": 11,
      "src": 17,
      "dst": 3,
      "length": 123.502526239912
    },
    {
      "id": 12,
      "src": 4,
      "dst": 7,
      "length": 100.9743372348429
    },
    {
      "id": 13,
      "src": 7,
      "dst": 4,
      "length": 100.9743372348429
    },
    {
      "id": 14,
      "src": 6,
      "dst": 7,
      "length": 58.85702770663077
    },
    {
      "id": 15,
      "src": 7,
      "dst": 6,
      "length": 58.85702770663077
    },
    {
      "id": 16,
      "src": 8,
      "dst": 9,
      "length": 107.7012067809803
    },
    {
      "id": 17,
      "src": 9,
      "dst": 8,
      "length": 107.7012067809803
    },
    {
      "id": 18,
      "src": 8,
      "dst": 11,
      "length": 100.7797542631112
    },
    {
      "id": 19,
      "src": 11,
      "dst": 8,
      "length": 100.7797542631112
    },
    {
      "id": 20,
      "src": 10,
      "dst": 11,
      "length": 142.935071154233
    },
    {
      "id": 21,
      "src": 11,
      "dst": 10,
      "length": 142.935071154233
    },
    {
      "id": 22,
      "src": 10,
      "dst": 13,
      "length": 112.280376164828
    },
    {
      "id": 23,
      "src": 13,
      "dst": 10,
      "length": 112.280376164828
    },
    {
      "id": 24,
      "src": 12,
      "dst": 13,
      "length": 132.6014600386424
    },
    {
      "id": 25,
      "src": 13,
      "dst": 12,
      "length": 132.6014600386424
    },
    {
      "id": 26,
      "src": 12,
      "dst": 15,
      "length": 114.1091942451913
    },
    {
      "id": 27,
      "src": 15,
      "dst": 12,
      "length": 114.1091942451913
    },
    {
      "id": 28,
      "src": 14,
      "dst": 17,
      "length": 120.972544952087
    },
    {
      "id": 29,
      "src": 17,
      "dst": 14,
      "length": 120.972544952087
    },
    {
      "id": 30,
      "src": 14,
      "dst": 15,
      "length": 89.08495741337417
    },
    {
      "id": 31,
      "src": 15,
      "dst": 14,
      "length": 89.08495741337417
    },
    {
      "id": 32,
      "src": 16,
      "dst": 17,
      "length": 104.6670832176189
    },
    {
      "id": 33,
      "src": 17,
      "dst": 16,
      "length": 104.6670832176189
    }
  ]
}
