{
  "alias": "RENATER",
  "name": "TOP_88_RENATER",
  "nodes": [
    {
      "id": 0
    },
    {
      "id": 1
    },
    {
      "id": 2
    },
    {
      "id": 3
    },
    {
      "id": 4
    },
    {
      "id": 5
    },
    {
      "id": 6
    },
    {
      "id": 7
    },
    {
      "id": 8
    },
    {
      "id": 9
    },
    {
      "id": 10
    },
    {
      "id": 11
    },
    {
      "id": 12
    },
    {
      "id": 13
    },
    {
      "id": 14
    },
    {
      "id": 15
    },
    {
      "id": 16
    },
    {
      "id": 17
    },
    {
      "id": 18
    },
    {
      "id": 19
    },
    {
      "id": 20
    },
    {
      "id": 21
    },
    {
      "id": 22
    },
    {
      "id": 23
    },
    {
      "id": 24
    },
    {
      "id": 25
    },
    {
      "id": 26
    }
  ],
  "links": [
    {
      "id": 0,
      "src": 0,
      "dst": 1,
      "length": 204.838876809736
    },
    {
      "id": 1,
      "src": 1,
      "dst": 0,
      "length": 204.838876809736
    },
    {
      "id": 2,
      "src": 0,
      "dst": 2,
      "length": 307.135115440902
    },
    {
      "id": 3,
      "src": 2,
      "dst": 0,
      "length": 307.135115440902
    },
    {
      "id": 4,
      "src": 1,
      "dst": 2,
      "length": 108.383373166042
    },
    {
      "id": 5,
      "src": 2,
      "dst": 1,
      "length": 108.383373166042
    },
    {
      "id": 6,
      "src": 2,
      "dst": 3,
      "length": 198.576777330228
    },
    {
      "id": 7,
      "src": 3,
      "dst": 2,
      "length": 198.576777330228
    },
    {
      "id": 8,
      "src": 2,
      "dst": 8,
      "length": 590.03745510248
    },
    {
      "id": 9,
      "src": 8,
      "dst": 2,
      "length": 590.03745510248
    },
    {
      "id": 10,
      "src": 2,
      "dst": 26,
      "length": 165.864322588038
    },
    {
      "id": 11,
      "src": 26,
      "dst": 2,
      "length": 165.864322588038
    },
    {
      "id": 12,
      "src": 2,
      "dst": 16,
      "length": 440.190149106402
    },
    {
      "id": 13,
      "src": 16,
      "dst": 2,
      "length": 440.190149106402
    },
    {
      "id": 14,
      "src": 2,
      "dst": 22,
      "length": 165.227218096153
    },
    {
      "id": 15,
      "src": 22,
      "dst": 2,
      "length": 165.227218096153
    },
    {
      "id": 16,
      "src": 3,
      "dst": 4,
      "length": 253.625186338797
    },
    {
      "id": 17,
      "src": 4,
      "dst": 3,
      "length": 253.625186338797
    },
    {
      "id": 18,
      "src": 4,
      "dst": 5,
      "length": 173.695286591785
    },
    {
      "id": 19,
      "src": 5,
      "dst": 4,
      "length": 173.695286591785
    },
    {
      "id": 20,
      "src": 5,
      "dst": 6,
      "length": 296.118414821324
    },
    {
      "id": 21,
      "src": 6,
      "dst": 5,
      "length": 296.118414821324
    },
    {
      "id": 22,
      "src": 6,
      "dst": 7,
      "length": 112.088429271704
    },
    {
      "id": 23,
      "src": 7,
      "dst": 6,
      "length": 112.088429271704
    },
    {
      "id": 24,
      "src": 7,
      "dst": 8,
      "length": 261.929176971129
    },
    {
      "id": 25,
      "src": 8,
      "dst": 7,
      "length": 261.929176971129
    },
    {
      "id": 26,
      "src": 8,
      "dst": 9,
      "length": 142.198268208719
    },
    {
      "id": 27,
      "src": 9,
      "dst": 8,
      "length": 142.198268208719
    },
    {
      "id": 28,
      "src": 8,
      "dst": 12,
      "length": 375.518825446673
    },
    {
      "id": 29,
      "src": 12,
      "dst": 8,
      "length": 375.518825446673
    },
    {
      "id": 30,
      "src": 8,
      "dst": 18,
      "length": 203.64194208922
    },
    {
      "id": 31,
      "src": 18,
      "dst": 8,
      "length": 203.64194208922
    },
    {
      "id": 32,
      "src": 9,
      "dst": 10,
      "length": 307.86609911131
    },
    {
      "id": 33,
      "src": 10,
      "dst": 9,
      "length": 307.86609911131
    },
    {
      "id": 34,
      "src": 10,
      "dst": 11,
      "length": 239.401579550886
    },
    {
      "id": 35,
      "src": 11,
      "dst": 10,
      "length": 239.401579550886
    },
    {
      "id": 36,
      "src": 11,
      "dst": 12,
      "length": 188.277938375392
    },
    {
      "id": 37,
      "src": 12,
      "dst": 11,
      "length": 188.277938375392
    },
    {
      "id": 38,
      "src": 12,
      "dst": 13,
      "length": 293.764953427563
    },
    {
      "id": 39,
      "src": 13,
      "dst": 12,
      "length": 293.764953427563
    },
    {
      "id": 40,
      "src": 13,
      "dst": 14,
      "length": 225.461210053238
    },
    {
      "id": 41,
      "src": 14,
      "dst": 13,
      "length": 225.461210053238
    },
    {
      "id": 42,
      "src": 14,
      "dst": 15,
      "length": 259.015552293153
    },
    {
      "id": 43,
      "src": 15,
      "dst": 14,
      "length": 259.015552293153
    },
    {
      "id": 44,
      "src": 13,
      "dst": 15,
      "length": 317.940061078348
    },
    {
      "id": 45,
      "src": 15,
      "dst": 13,
      "length": 317.940061078348
    },
    {
      "id": 46,
      "src": 15,
      "dst": 16,
      "length": 309.21999360776
    },
    {
      "id": 47,
      "src": 16,
      "dst": 15,
      "length": 309.21999360776
    },
    {
      "id": 48,
      "src": 16,
      "dst": 17,
      "length": 163.754427729405
    },
    {
      "id": 49,
      "src": 17,
      "dst": 16,
      "length": 163.754427729405
    },
    {
      "id": 50,
      "src": 16,
      "dst": 26,
      "length": 283.178847854488
    },
    {
      "id": 51,
      "src": 26,
      "dst": 16,
      "length": 283.178847854488
    },
    {
      "id": 52,
      "src": 16,
      "dst": 19,
      "length": 240.709994185667
    },
    {
      "id": 53,
      "src": 19,
      "dst": 16,
      "length": 240.709994185667
    },
    {
      "id": 54,
      "src": 17,
      "dst": 18,
      "length": 211.529713997921
    },
    {
      "id": 55,
      "src": 18,
      "dst": 17,
      "length": 211.529713997921
    },
    {
      "id": 56,
      "src": 19,
      "dst": 23,
      "length": 121.043523684447
    },
    {
      "id": 57,
      "src": 23,
      "dst": 19,
      "length": 121.043523684447
    },
    {
      "id": 58,
      "src": 19,
      "dst": 20,
      "length": 149.565910700829
    },
    {
      "id": 59,
      "src": 20,
      "dst": 19,
      "length": 149.565910700829
    },
    {
      "id": 60,
      "src": 20,
      "dst": 21,
      "length": 229.987194956398
    },
    {
      "id": 61,
      "src": 21,
      "dst": 20,
      "length": 229.987194956398
    },
    {
      "id": 62,
      "src": 21,
      "dst": 22,
      "length": 164.277160609869
    },
    {
      "id": 63,
      "src": 22,
      "dst": 21,
      "length": 164.277160609869
    },
    {
      "id": 64,
      "src": 23,
      "dst": 24,
      "length": 122.31295889346
    },
    {
      "id": 65,
      "src": 24,
      "dst": 23,
      "length": 122.31295889346
    },
    {
      "id": 66,
      "src": 24,
      "dst": 25,
      "length": 116.851397341314
    },
    {
      "id": 67,
      "src": 25,
      "dst": 24,
      "length": 116.851397341314
    },
    {
      "id": 68,
      "src": 25,
      "dst": 26,
      "length": 161.540100224565
    },
    {
      "id": 69,
      "src": 26,
      "dst": 25,
      "length": 161.540100224565
    }
  ]
}
