{
  "alias": "GBLNET",
  "name": "TOP_34_GBLNET",
  "nodes": [
    {
      "id": 0
    },
    {
      "id": 1
    },
    {
      "id": 2
    },
    {
      "id": 3
    },
    {
      "id": 4
    },
    {
      "id": 5
    },
    {
      "id": 6
    },
    {
      "id": 7
    }
  ],
  "links": [
    {
      "id": 0,
      "src": 0,
      "dst": 5,
      "length": 521.6095788482335
    },
    {
      "id": 1,
      "src": 5,
      "dst": 0,
      "length": 521.6095788482335
    },
    {
      "id": 2,
      "src": 1,
      "dst": 5,
      "length": 535.6163051270169
    },
    {
      "id": 3,
      "src": 5,
      "dst": 1,
      "length": 535.6163051270169
    },
    {
      "id": 4,
      "src": 2,
      "dst": 3,
      "length": 1032.15219238748
    },
    {
      "id": 5,
      "src": 3,
      "dst": 2,
      "length": 1032.15219238748
    },
    {
      "id": 6,
      "src": 2,
      "dst": 5,
      "length": 1500.0
    },
    {
      "id": 7,
      "src": 5,
      "dst": 2,
      "length": 1500.0
    },
    {
      "id": 8,
      "src": 3,
      "dst": 4,
      "length": 949.8667213173954
    },
    {
      "id": 9,
      "src": 4,
      "dst": 3,
      "length": 949.8667213173954
    },
    {
      "id": 10,
      "src": 5,
      "dst": 6,
      "length": 545.2339470871901
    },
    {
      "id": 11,
      "src": 6,
      "dst": 5,
      "length": 545.2339470871901
    },
    {
      "id": 12,
      "src": 5,
      "dst": 7,
      "length": 645.6357804808555
    },
    {
      "id": 13,
      "src": 7,
      "dst": 5,
      "length": 645.6357804808555
    }
  ]
}
