{
  "alias": "PSINET",
  "name": "TOP_84_PSINET",
  "nodes": [
    {
      "id": 0
    },
    {
      "id": 1
    },
    {
      "id": 2
    },
    {
      "id": 3
    },
    {
      "id": 4
    },
    {
      "id": 5
    },
    {
      "id": 6
    },
    {
      "id": 7
    },
    {
      "id": 8
    },
    {
      "id": 9
    },
    {
      "id": 10
    },
    {
      "id": 11
    },
    {
      "id": 12
    },
    {
      "id": 13
    },
    {
      "id": 14
    },
    {
      "id": 15
    },
    {
      "id": 16
    },
    {
      "id": 17
    },
    {
      "id": 18
    },
    {
      "id": 19
    },
    {
      "id": 20
    },
    {
      "id": 21
    },
    {
      "id": 22
    },
    {
      "id": 23
    }
  ],
  "links": [
    {
      "id": 0,
      "src": 0,
      "dst": 3,
      "length": 128.3933603139128
    },
    {
      "id": 1,
      "src": 3,
      "dst": 0,
      "length": 128.3933603139128
    },
    {
      "id": 2,
      "src": 1,
      "dst": 2,
      "length": 1500.0
    },
    {
      "id": 3,
      "src": 2,
      "dst": 1,
      "length": 1500.0
    },
    {
      "id": 4,
      "src": 1,
      "dst": 3,
      "length": 1500.0
    },
    {
      "id": 5,
      "src": 3,
      "dst": 1,
      "length": 1500.0
    },
    {
      "id": 6,
      "src": 1,
      "dst": 4,
      "length": 1324.067201764712
    },
    {
      "id": 7,
      "src": 4,
      "dst": 1,
      "length": 1324.067201764712
    },
    {
      "id": 8,
      "src": 2,
      "dst": 3,
      "length": 509.8435626304135
    },
    {
      "id": 9,
      "src": 3,
      "dst": 2,
      "length": 509.8435626304135
    },
    {
      "id": 10,
      "src": 2,
      "dst": 15,
      "length": 627.5025611615271
    },
    {
      "id": 11,
      "src": 15,
      "dst": 2,
      "length": 627.5025611615271
    },
    {
      "id": 12,
      "src": 4,
      "dst": 5,
      "length": 85.61340860642284
    },
    {
      "id": 13,
      "src": 5,
      "dst": 4,
      "length": 85.61340860642284
    },
    {
      "id": 14,
      "src": 5,
      "dst": 8,
      "length": 862.4466435705526
    },
    {
      "id": 15,
      "src": 8,
      "dst": 5,
      "length": 862.4466435705526
    },
    {
      "id": 16,
      "src": 6,
      "dst": 12,
      "length": 521.0951719218651
    },
    {
      "id": 17,
      "src": 12,
      "dst": 6,
      "length": 521.0951719218651
    },
    {
      "id": 18,
      "src": 6,
      "dst": 7,
      "length": 1280.659967318184
    },
    {
      "id": 19,
      "src": 7,
      "dst": 6,
      "length": 1280.659967318184
    },
    {
      "id": 20,
      "src": 7,
      "dst": 23,
      "length": 1500.0
    },
    {
      "id": 21,
      "src": 23,
      "dst": 7,
      "length": 1500.0
    },
    {
      "id": 22,
      "src": 8,
      "dst": 9,
      "length": 1023.08605411639
    },
    {
      "id": 23,
      "src": 9,
      "dst": 8,
      "length": 1023.08605411639
    },
    {
      "id": 24,
      "src": 9,
      "dst": 13,
      "length": 182.2082908548479
    },
    {
      "id": 25,
      "src": 13,
      "dst": 9,
      "length": 182.2082908548479
    },
    {
      "id": 26,
      "src": 10,
      "dst": 12,
      "length": 459.728758316418
    },
    {
      "id": 27,
      "src": 12,
      "dst": 10,
      "length": 459.728758316418
    },
    {
      "id": 28,
      "src": 11,
      "dst": 12,
      "length": 1181.526912522182
    },
    {
      "id": 29,
      "src": 12,
      "dst": 11,
      "length": 1181.526912522182
    },
    {
      "id": 30,
      "src": 12,
      "dst": 13,
      "length": 20.83436718327859
    },
    {
      "id": 31,
      "src": 13,
      "dst": 12,
      "length": 20.83436718327859
    },
    {
      "id": 32,
      "src": 14,
      "dst": 19,
      "length": 2102.128051806963
    },
    {
      "id": 33,
      "src": 19,
      "dst": 14,
      "length": 2102.128051806963
    },
    {
      "id": 34,
      "src": 14,
      "dst": 22,
      "length": 1095.95956804919
    },
    {
      "id": 35,
      "src": 22,
      "dst": 14,
      "length": 1095.95956804919
    },
    {
      "id": 36,
      "src": 14,
      "dst": 15,
      "length": 580.7625411994072
    },
    {
      "id": 37,
      "src": 15,
      "dst": 14,
      "length": 580.7625411994072
    },
    {
      "id": 38,
      "src": 16,
      "dst": 17,
      "length": 92.77121696685674
    },
    {
      "id": 39,
      "src": 17,
      "dst": 16,
      "length": 92.77121696685674
    },
    {
      "id": 40,
      "src": 16,
      "dst": 18,
      "length": 838.7553033988663
    },
    {
      "id": 41,
      "src": 18,
      "dst": 16,
      "length": 838.7553033988663
    },
    {
      "id": 42,
      "src": 18,
      "dst": 19,
      "length": 861.3692628497527
    },
    {
      "id": 43,
      "src": 19,
      "dst": 18,
      "length": 861.3692628497527
    },
    {
      "id": 44,
      "src": 20,
      "dst": 23,
      "length": 354.0915074929874
    },
    {
      "id": 45,
      "src": 23,
      "dst": 20,
      "length": 354.0915074929874
    },
    {
      "id": 46,
      "src": 21,
      "dst": 22,
      "length": 72.02261095132675
    },
    {
      "id": 47,
      "src": 22,
      "dst": 21,
      "length": 72.02261095132675
    },
    {
      "id": 48,
      "src": 22,
      "dst": 23,
      "length": 544.4600499700148
    },
    {
      "id": 49,
      "src": 23,
      "dst": 22,
      "length": 544.4600499700148
    }
  ]
}
